{
  "request_id": "deck-audit-numbers-v1",
  "status": "COMPLETE",
  "results": {
    "coverage": [
      {
        "slide": 6,
        "items_checked": 11,
        "exceptions": 0
      },
      {
        "slide": 7,
        "items_checked": 9,
        "exceptions": 0
      },
      {
        "slide": 8,
        "items_checked": 17,
        "exceptions": 0
      },
      {
        "slide": 9,
        "items_checked": 47,
        "exceptions": 0
      },
      {
        "slide": 10,
        "items_checked": 49,
        "exceptions": 0
      },
      {
        "slide": 11,
        "items_checked": 0,
        "exceptions": 0
      },
      {
        "slide": 12,
        "items_checked": 3,
        "exceptions": 0
      },
      {
        "slide": 13,
        "items_checked": 0,
        "exceptions": 0
      }
    ],
    "findings": [],
    "clean_dimensions": [
      "Source-value matching for all substantive deck numbers on slides 6 through 13.",
      "Attribution of each value to the correct analysis, event stage, payment arm, outcome, test, baseline, and sample.",
      "Derived arithmetic for the slide 8 confidence interval and effect-size ratio, all plotted slide 9 and slide 10 confidence intervals, and the slide 10 direct-Wald confidence interval.",
      "Cross-slide recurrence consistency and PDF vector-chart geometry, including axis bounds, point locations, whisker endpoints, and Wald-bracket labels."
    ],
    "operator_should_check_locally": []
  },
  "artifacts_manifest": [
    {
      "filename": "audit_numbers_findings.md",
      "status": "CREATED",
      "media_type": "text/markdown",
      "size": 1779,
      "sha256": "b1f35d5b04c2c955df66f09b3a8cabe2c30f8cc5eb6c5e969155a500b6e82dab"
    }
  ],
  "limitations": [],
  "delivery": [
    "audit_numbers_response.json",
    "audit_numbers_findings.md"
  ]
}
